{"active_compose_files":["infra/compose.yaml","infra/compose.staging.yaml","infra/compose.production.yaml"],"certificate_contact":"ops@esmii.invalid","change_targets":["public-edge"],"compose_project":"esmii-host","deployment_epoch":"fixture-epoch-0001","deployment_sequence":3,"environments":{"production":{"admin_health_cidrs":["192.0.2.10/32"],"app_domain":"esmii.app","application_payload_digest":"sha256:cccccccccccccccccccccccccccccccccccccccccccccccccccccccccccccccc","bounce_domain":"bounce.esmii.invalid","caddy_ip":"172.30.20.2","ci_evidence_digest":"sha256:eeeeeeeeeeeeeeeeeeeeeeeeeeeeeeeeeeeeeeeeeeeeeeeeeeeeeeeeeeeeeeee","config_digest":"sha256:3333333333333333333333333333333333333333333333333333333333333333","edge_fragment_digest":"sha256:3f3404ba8cf9ea3f3d1d1e2d1353ca6a08d50c6781b23c3f371e1f3a9343767b","edge_mode":"public","edge_subnet":"172.30.20.0/24","mail_config_digest":"sha256:4444444444444444444444444444444444444444444444444444444444444444","mail_domain":"esmii.invalid","mail_evidence_digest":null,"mail_hostname":"mail.esmii.invalid","mail_mode":"private","prelaunch_test_cidrs":[],"prelaunch_test_cidrs_digest":null,"production_mail_admin_subnet":"172.30.30.0/24","schema_transition":{"from":"empty","to":"0001_prompt03_identity_organizations"},"sealed_input_record_id":"fixture-production-input-0001","sealed_input_record_mac":"hmac-sha256:ffffffffffffffffffffffffffffffffffffffffffffffffffffffffffffffff","server_image":"ghcr.io/malmazrou/esmii-server@sha256:bbbbbbbbbbbbbbbbbbbbbbbbbbbbbbbbbbbbbbbbbbbbbbbbbbbbbbbbbbbbbbbb","source_sha":"1111111111111111111111111111111111111111","stalwart_mail_admin_ip":"172.30.30.2","web_image":"ghcr.io/malmazrou/esmii-web@sha256:aaaaaaaaaaaaaaaaaaaaaaaaaaaaaaaaaaaaaaaaaaaaaaaaaaaaaaaaaaaaaaaa"},"staging":{"admin_health_cidrs":["192.0.2.10/32"],"app_domain":"staging.esmii.invalid","application_payload_digest":"sha256:cccccccccccccccccccccccccccccccccccccccccccccccccccccccccccccccc","caddy_ip":"172.30.10.2","ci_evidence_digest":"sha256:eeeeeeeeeeeeeeeeeeeeeeeeeeeeeeeeeeeeeeeeeeeeeeeeeeeeeeeeeeeeeeee","config_digest":"sha256:dddddddddddddddddddddddddddddddddddddddddddddddddddddddddddddddd","edge_subnet":"172.30.10.0/24","schema_transition":{"from":"empty","to":"0001_prompt03_identity_organizations"},"sealed_input_record_id":"fixture-staging-input-0001","sealed_input_record_mac":"hmac-sha256:2222222222222222222222222222222222222222222222222222222222222222","server_image":"ghcr.io/malmazrou/esmii-server@sha256:bbbbbbbbbbbbbbbbbbbbbbbbbbbbbbbbbbbbbbbbbbbbbbbbbbbbbbbbbbbbbbbb","source_sha":"1111111111111111111111111111111111111111","web_image":"ghcr.io/malmazrou/esmii-web@sha256:aaaaaaaaaaaaaaaaaaaaaaaaaaaaaaaaaaaaaaaaaaaaaaaaaaaaaaaaaaaaaaaa"}},"infrastructure_sha":"1111111111111111111111111111111111111111","previous_activation_manifest_digest":"sha256:fa65c3ac01ca10e8402d6b695b78fa6a0b6db6720c2ac0a609430b59af20de0a","previous_release_id":"fixture-production-restricted","promotion_source_checkpoint_digest":"sha256:ffffffffffffffffffffffffffffffffffffffffffffffffffffffffffffffff","release_id":"fixture-production-public","rendered_compose_digest":"sha256:69b7d3fd0713c35b18907a0808be27a657a3d504405a79b48692cf8863b6eafb","schema_version":1,"shared_config_digest":"sha256:2e044d4712c1e9a287f8d98269cc0d50abf8f6d9d2d5b38bcdadb41943f07ff9","shared_infrastructure_payload_digest":"sha256:19e7abdf2e6134059ef9179730f26da6105729e17aeddd9a8aa8649b6af23756"}
