{"active_compose_files":["infra/compose.yaml","infra/compose.staging.yaml","infra/compose.production.yaml"],"certificate_contact":"ops@esmii.invalid","change_targets":["production"],"compose_project":"esmii-host","deployment_epoch":"fixture-epoch-0001","deployment_sequence":2,"environments":{"production":{"admin_health_cidrs":["192.0.2.10/32"],"app_domain":"esmii.app","application_payload_digest":"sha256:cccccccccccccccccccccccccccccccccccccccccccccccccccccccccccccccc","bounce_domain":"bounce.esmii.invalid","caddy_ip":"172.30.20.2","ci_evidence_digest":"sha256:eeeeeeeeeeeeeeeeeeeeeeeeeeeeeeeeeeeeeeeeeeeeeeeeeeeeeeeeeeeeeeee","config_digest":"sha256:3333333333333333333333333333333333333333333333333333333333333333","edge_fragment_digest":"sha256:72371c75151b8639fe2fa13c868fd2807f189975e35a09fc80ed01bab74c4274","edge_mode":"restricted","edge_subnet":"172.30.20.0/24","mail_config_digest":"sha256:4444444444444444444444444444444444444444444444444444444444444444","mail_domain":"esmii.invalid","mail_evidence_digest":null,"mail_hostname":"mail.esmii.invalid","mail_mode":"private","prelaunch_test_cidrs":["198.51.100.20/32"],"prelaunch_test_cidrs_digest":"sha256:5555555555555555555555555555555555555555555555555555555555555555","production_mail_admin_subnet":"172.30.30.0/24","schema_transition":{"from":"empty","to":"0001_prompt03_identity_organizations"},"sealed_input_record_id":"fixture-production-input-0001","sealed_input_record_mac":"hmac-sha256:ffffffffffffffffffffffffffffffffffffffffffffffffffffffffffffffff","server_image":"ghcr.io/malmazrou/esmii-server@sha256:bbbbbbbbbbbbbbbbbbbbbbbbbbbbbbbbbbbbbbbbbbbbbbbbbbbbbbbbbbbbbbbb","source_sha":"1111111111111111111111111111111111111111","stalwart_mail_admin_ip":"172.30.30.2","web_image":"ghcr.io/malmazrou/esmii-web@sha256:aaaaaaaaaaaaaaaaaaaaaaaaaaaaaaaaaaaaaaaaaaaaaaaaaaaaaaaaaaaaaaaa"},"staging":{"admin_health_cidrs":["192.0.2.10/32"],"app_domain":"staging.esmii.invalid","application_payload_digest":"sha256:cccccccccccccccccccccccccccccccccccccccccccccccccccccccccccccccc","caddy_ip":"172.30.10.2","ci_evidence_digest":"sha256:eeeeeeeeeeeeeeeeeeeeeeeeeeeeeeeeeeeeeeeeeeeeeeeeeeeeeeeeeeeeeeee","config_digest":"sha256:dddddddddddddddddddddddddddddddddddddddddddddddddddddddddddddddd","edge_subnet":"172.30.10.0/24","schema_transition":{"from":"empty","to":"0001_prompt03_identity_organizations"},"sealed_input_record_id":"fixture-staging-input-0001","sealed_input_record_mac":"hmac-sha256:2222222222222222222222222222222222222222222222222222222222222222","server_image":"ghcr.io/malmazrou/esmii-server@sha256:bbbbbbbbbbbbbbbbbbbbbbbbbbbbbbbbbbbbbbbbbbbbbbbbbbbbbbbbbbbbbbbb","source_sha":"1111111111111111111111111111111111111111","web_image":"ghcr.io/malmazrou/esmii-web@sha256:aaaaaaaaaaaaaaaaaaaaaaaaaaaaaaaaaaaaaaaaaaaaaaaaaaaaaaaaaaaaaaaa"}},"infrastructure_sha":"1111111111111111111111111111111111111111","previous_activation_manifest_digest":"sha256:d5bf9fcdfaf9dc11b9180e7674cc9d472cc535ace5fd59077c004b4a221cb34e","previous_release_id":"fixture-staging","promotion_source_checkpoint_digest":"sha256:ffffffffffffffffffffffffffffffffffffffffffffffffffffffffffffffff","release_id":"fixture-production-restricted","rendered_compose_digest":"sha256:69b7d3fd0713c35b18907a0808be27a657a3d504405a79b48692cf8863b6eafb","schema_version":1,"shared_config_digest":"sha256:136582093337c28a9d696ecd8248cc3c9e29b8b027660355259a24757768c804","shared_infrastructure_payload_digest":"sha256:19e7abdf2e6134059ef9179730f26da6105729e17aeddd9a8aa8649b6af23756"}
