{"active_compose_files":["infra/compose.yaml","infra/compose.staging.yaml"],"certificate_contact":"ops@esmii.invalid","change_targets":["shared-infrastructure","staging"],"compose_project":"esmii-host","deployment_epoch":"fixture-epoch-0001","deployment_sequence":1,"environments":{"production":null,"staging":{"admin_health_cidrs":["192.0.2.10/32"],"app_domain":"staging.esmii.invalid","application_payload_digest":"sha256:cccccccccccccccccccccccccccccccccccccccccccccccccccccccccccccccc","caddy_ip":"172.30.10.2","ci_evidence_digest":"sha256:eeeeeeeeeeeeeeeeeeeeeeeeeeeeeeeeeeeeeeeeeeeeeeeeeeeeeeeeeeeeeeee","config_digest":"sha256:dddddddddddddddddddddddddddddddddddddddddddddddddddddddddddddddd","edge_subnet":"172.30.10.0/24","schema_transition":{"from":"empty","to":"0001_prompt03_identity_organizations"},"sealed_input_record_id":"fixture-staging-input-0001","sealed_input_record_mac":"hmac-sha256:2222222222222222222222222222222222222222222222222222222222222222","server_image":"ghcr.io/malmazrou/esmii-server@sha256:bbbbbbbbbbbbbbbbbbbbbbbbbbbbbbbbbbbbbbbbbbbbbbbbbbbbbbbbbbbbbbbb","source_sha":"1111111111111111111111111111111111111111","web_image":"ghcr.io/malmazrou/esmii-web@sha256:aaaaaaaaaaaaaaaaaaaaaaaaaaaaaaaaaaaaaaaaaaaaaaaaaaaaaaaaaaaaaaaa"}},"infrastructure_sha":"1111111111111111111111111111111111111111","previous_activation_manifest_digest":null,"previous_release_id":null,"promotion_source_checkpoint_digest":null,"release_id":"fixture-staging","rendered_compose_digest":"sha256:1dac5e7fb2e9a17e56089593d26ef35a7fe27c9a2c2d8a2269308c5bc6a332a4","schema_version":1,"shared_config_digest":"sha256:53ce1221afeb8676091992810159e91ae07f998f1912bfb9f543f3ea2ed89ad0","shared_infrastructure_payload_digest":"sha256:4a7c62b84edf58d1f57f2748be18d9b4cdd3fd48afaa9841f730d3e9aef31f3b"}
